articleText,category,date,heading,id,page,pageSequence,relevance,snippet,title,troveUrl,url,title_name,title_id
"<p><span>  .  FARLEIGH.  '</span></p> <p><span>  :  (From.'  Our  Correspondent.)</span></p> <p><span>  The  prevailing'  weatlicr  for  .Weeks</span><span>  past  is  very  trying  and  anything  hut</span><span>  safe  to  I'h'ose  occupied  in  our-do-or  lab-</span><span>  imr  The-  mercury  constantly  was'</span><span>  Merging  on  the-  hundreds,  while  at</span><span>  limes  there  was  not  a.  -breath  of  air</span></p> <p><span>  So""  fan  the  .  perspiring  broay.  There</span><span>  .  5axe  iuan>'  reports  of  ..Morses  dy-opping</span><span>  in  tljc  yoke,  and'  fatal  cases  have</span><span>  '  joccurred  among  horsqs  browsing  in</span><span>  '  jhe  .paddock.  Almost  daily  distant</span><span>  1  'tjrandei'stoiiuis  are  visible,  -but  so  far</span><span>  iiavc  failed  to  proflucc  thc-longcd-for</span><span>  rain  to  cool  the  air.</span><span>  ""So  'far'  this  district  '-has  been  blcss-></span><span>  ,  :  -jed  with  a  good  supply  of.  moisture,</span><span>  i1  '  fSd  the  crops  on  all  sides.  show  its</span><span>  Effect,  ib  lit  we  begin  to  feel  concerned</span><span>  \  ifpr  the  coining  time.  February,  our</span><span>  /'  suali.wet  season  month,  is  now  out,  i</span><span>  /'aiid  so  far  there  is  no  'indication  of</span><span>  '  itie  necessany-  tropica!'  fall""  for  the</span><span>  ;  jmdcrgrovhid  '  storage.  Many  plots</span><span>  iY,'-'aie  ready  'for  'cane  planting,  but  the</span><span>  -y  :  -farmers  are  shy  t-u  start  till  the</span><span>  '  .  hoped-for.  wet  -  season  is'  past.</span><span>  '  I  uotiee-so-me.  very  good  fields  of</span><span>  jcevrpea  around  lier.e,  in  fact  passing</span><span>  JSj  a  field  Jgtely  .1  culled-  at.  ra  ndoma</span><span>  strain!  which  measured  Dll  4in>.  in</span><span>  length.  We  gn  the  North  Side,  liav-</span><span>  ing  little  experience  witli  the  pea,'</span><span>  .would-  like'  to  kno-w  ""if  that  were'  ir</span><span>  good  or  ,a  fair  sample  o'f  growth-  for</span><span>  #he  purpose  'of  'groeu  manuring;  the</span><span>  hrop  also'  4s  very  thick.''  The  Home-</span><span>  Jbuslv  farmers  arc  conversant  .with-  the</span><span>  feature  o'f-&lt;  this  mode  -of.  manuring;</span><span>  may  I  beg  the  favour  of  y.toU'  Hoane-</span><span>  Irasli  correspondent  to  refer  to  'this</span><span>  'jn  his  next  notes  to,  the  ""Daily  Mer-</span><span>  Jcniy,""  -and  also  Jnifoiim-  ujs""  /  (new/</span><span>  Chums  at  the  work)  abpiit'w'liat  time</span><span>  after  the  peas  are  ploughed  in  could</span><span>  the  paddock-  be  cross-ploughed?-  1</span><span>  ..'4  A  new  'departure  has  -  taken  place</span><span>  in  the  social  Life  of  '  this  district,  in</span><span>  /the  inauguration  by  the  young-  people</span><span>  and  ably  aided  by  a,  few  of  the  mar</span><span>  ried  ladies,  of  what  is  known  as  the.</span><span>  Farlei'gh  Social.  Club,.  ,  I  understand,</span><span>  fhe  dbjCet?  of  the  Cluibto-is  'to.;  raise</span><span>  !01  any  deserving  purpose.  The.</span><span>  initial  attempt  of  the  new  Club  took</span><span>  place-  at  Peterson's  hall""  o.n  Saturday</span><span>  night-  for  the  purpose  of'  acquiring</span><span>  fcrockery,  etc.,  for  the  future,  -use  of</span><span>  iflo  Club;  and  their>  well  arranged</span><span>  .exertions  w:ere  rewarded  by  a  bum</span><span>  per  house.  IJtot'heir  firgfc  soeiflj  be  a</span><span>  .driterion  of  the,  future  tliey  .will,  well</span><span>  justify  their  existence.  The  .music'</span><span>  supplied  by  Mis.  Gi'tison  an&lt;l</span><span>  ss  Thoratqn.  while  the  extras  were</span><span>  played  by  Prafessilr  Hazelto,n  and</span><span>  hss  MeDo'wd.  friiin  Maekay;""  the</span><span>  JjJsC.ship  -  was  in  tlie-'-iible  hands  of</span><span>  ®r.  J.  -J.  O'ltiordan.  At  '11.30  a</span><span>  plentiful  (-'supply  of  dukes,  tea  and</span><span>  4®""ee  was  handed  round,  and  .highly</span><span>  appreciated.  A  lengthy  programme</span><span>  .flf  dances  was  finished  soon  after  mid-</span><span>  ""ght,  wlie.ii;.  the  guests,  departed  for</span><span>  name,  each.'  voting  the  evening  as  be-</span><span>  0,ue  jji'  ""the  jolliest,,  of  their  lives.</span><span>  The  onemlb'ers  of  'the  Pioneer  'branch</span><span>  w  the  P;4?,.F.  ;  &  Qt  A.  recently  -held</span><span>  Weir  first  '  annual  .  meeting,  when'  -the</span><span>  flowing  officers  were  elected  for  the</span><span>  wtmuig..  year:  Mr  G  R.  Jarvis,</span><span>  '.ohairman  5.  Mr.  :  J,  ,T..  O'Riordan,  vice-</span><span>  Hainman;  Mr.  J..  R.  .Thornton,  see-</span><span>  ;retary  and  delegate  to  the  Coimcil.</span><span>  dte  retiring  eliniraiinh  paid  a  high</span><span>  -f  I""1!0  Hie  'members'  of  that  branch</span><span>  .jg01'  e'-r'':  1'oyal  attendance  to  the</span><span>  iy  i  Jeeiting.i  tlirongli  the  past</span><span>  .jj8'  and  '-in  looking  baek  on:  thp  past</span><span>  ;2Jap».  'work  '  remarked:;  that'  every</span><span>  ember  was  -  eonstnntly  financially</span><span>  -'Booa  on  flw,ii:ookh.  ;  ;  ;  ;</span><span>  n  view  of  the  possibility  ,  of  -the</span><span>  .t  ,  eff?  of  eriim  cutters  for  tjip  pre-</span><span>  p;11  croP.  the  farmers  of  Dnnilbleton,</span><span>  ,',4.'Pneer  £»d  Fonldien  have:  made  an</span><span>  to  fry  the.  system'  of  gang</span><span>  .ii  The  manager  has  promised</span><span>  lint;  H,c,n  all-  he  can,  and  nego-</span><span>  .jWions  with  certain  nwm  are  procecd-</span><span>  J  hn-po  in  the  near  future  to  ,  be</span><span>  Scheme  su&lt;!cess  of  the</span><span>  -  Sleigh,  28/2/16.</span></p> ",Article,1916-03-02,FARLEIGH.,172298136,2,2,"{'score': '114.71976', 'value': 'very relevant'}",The prevailing weather for weeks past is very trying and anything but safe to those occupied in our-door labour. The mercury constantly was,"{'id': '837', 'value': 'Daily Mercury (Mackay, Qld. : 1906 - 1954)'}",https://trove.nla.gov.au/ndp/del/article/172298136?searchTerm=%27Daily+Mercury%27,/newspaper/172298136,"Daily Mercury (Mackay, Qld. : 1906 - 1954)",837
"<p><span>  i  —</span><span>  f  ;JHEr;BILLY  CAN</span><span>  I  t  —</span></p> <p><span>  Private  J.  Elliott,  3rd  -Fiold  Am</span><span>  bulance,  writes  to  th0  ,w  'Mercury""</span><span>  from  Mena-Hogse  Hospital,  ,  the  Py</span><span>  ramids,  under  -j  date  Christmas,,  Day.</span><span>  flyn  tak:ng  the  liberty  in  these</span><span>  few,  lines  of  wishing  you,  the  s(aff,'</span><span>  and  your,  readers  .the  compliments</span></p> <p><span>  of  1.1  e  season,  .  One  '  would  _  hardly</span><span>  think  tberq  is  .s(ich  a  thing''as  war</span><span>  on  uo-w  '.jddgintf'  by  the  appearaiee</span><span>  of  tho  gaily  ua""-sed  -tliiong  that  pass-',</span><span>  fed  here  -the  List  week;  everybody</span><span>  seeius  to  Jjo  a  kind  of  '  tourist  around</span><span>  here.  _  X  have-  nbeen  around  (the</span><span>  pyramid's  hiit  I'm  not-  yet  ,e&lt;iual  to</span><span>  the  climb.  We  all  hung'  up  :pur</span><span>  socks,  shirts,  trousers,  etc,  last  might/</span><span>  the  night  -Sisters""  got  .shock,</span><span>  when  coming  on  duty!  However,</span><span>  wo  nil  got  a  ,  present  q£.  some,  stfr.t;</span></p> <p><span>  apparcntiy  we  a\e.  not  yet  toiotten.</span><span>  I  suppose  ""you-  all  know'  about  the</span><span>  evacuation  ""of  Anzah  by  the  Austi'ai-i</span><span>  inns,  add  I  daresay  the  details  ""are</span><span>  hotter  known  to  the  Australian  peo</span><span>  ple  at  home  than  to  us;  neverthe</span><span>  less  I  venture  j)  say  thqt-  every  Aus</span><span>  tralian  who  ""had  bocn.-at  Anzae.  will</span><span>  life5'4""  toufehy""  '  on  the  Anzac  queS-</span><span>  ,  i  tick  —  to  ""think,  all  the  lives,  '  litbdur,</span><span>  hardships,  etc.,  have"",  been  useless.""</span><span>  O'f  course  the  ""heads""  might  have</span><span>  some./'ornclB""  in  view,  -but  what</span><span>  about  ""the  ""boys""  we  hiiried  therg?</span><span>  —  d-id-'i  they.  .ever  dream  of  this  when,</span><span>  y  they  chased  ""Abdul  "".off  those  gor-</span><span>  I  ges?  (The  ..Turk  ,  „  said  .  (he  was</span><span>  I  going  to  jiusli!  us  .  pit  .  the  Peninsula</span><span>  'iind-  tried  it  hard  jtaveral.  times,  but</span><span>  lie  was  a  joke  for  'us  at  any  time;</span><span>  I  and-  now  \vc  find  w-e  are  fcollfl.  td'leifvc.</span><span>  jit's  hard-  for  us  to  express  our  fccl-</span><span>  I  ings  on  the  matter.  I  hunted-  up</span><span>  Captain  Stuart  Kay,  of  the  1st  A.G-</span><span>  H..„and  scored  'seven  copies  ""of  the</span><span>  ""Daily!  Merenry.""  You  can  guess</span><span>  how  I  read-  them;  I  have  not  recei</span><span>  ved  one  ldtter  yet  from  home.  M-y  ad-</span><span>  .di-ess  had  been-  so1.  unset  tied,  and,  just</span><span>  t.liiiik,'  I.  got  to  Gallipoli  ;ibout  seven</span><span>  I  weeks  after  leaving  Sydney.  It  took</span><span>  us  six  weeks  to-  reach  Suez  and  we</span><span>  I  neV'er  touched-  a  port  all  the  jour-</span><span>  ney.  We  .travelled  that  fast  that</span><span>  one  oldl  ""tub""'  asked  us.  which  way</span><span>  wo  were  going,  and  the  rest  steered</span><span>  clear  of  us  —  afraid  of  being  caught</span><span>  in  the.  suction  of  the  propcllors.  I</span><span>  was  th  ree  ./days  in-  Egypt/  and  tlipn</span><span>  embarked:  from  Alexandria  to  JVIud-</span><span>  ros;  got4  chased  by  a  submarine  the</span><span>  same  day  that  the  Marquette  was</span><span>  sunk.-  Our'  ship,  the  Minneapolis,</span><span>  fairly  flow.  through  the  Mediterran</span><span>  ean  '  -Sea  and  twisted  and  turned</span><span>  every  night.  We.  -never  removed  our</span><span>  lifebelts  for  .three  days,  until  we</span><span>  got-  10  Mudros  and  then  we  tranship-</span><span>  ''pfed  again  .on  to  a'  smaller  ship  £pr</span><span>  the'  Peninsula,  and  managed  to  re</span><span>  main  on  terra-firma,  notwithstand</span><span>  ing  Abdul's  many  presents  sent  over</span><span>  to""  us  until  it  began  to  snow  and</span><span>  freeze  About  10  days  afterwards</span><span>  the  doctor  had  a  look  at  'fyours</span><span>  etc.""  with  his  -  stethesc'ope,  and1  said;</span><span>  /lie  ""was  sorry,  etc.""  I  was  seven</span><span>  /day's  in  bed  in  the  2nd.  Australian;</span><span>  '  General  Hospital,'  Cairo_  '(a  home.,</span><span>  from  home),  and  then  sent""  here  to</span><span>  recoup.  It  would  be  a  -bard  matter</span><span>  to  tell  you  hoW  much  we  think  of  the</span><span>  Australian  sisters  The  majority  of.</span><span>  us  laniT  in  our  hospitals  in  Egypt-</span><span>  broken  kp  -mofe  or  lesS,  mentally</span><span>  and  physically,  but  there's  always  .:a</span><span>  nice  real  Australian  sister  either</span><span>  bending  over  one's  bed,,  ready  al</span><span>  ways  to  '  do  anything  for  a  chap;</span><span>  it's  funnv  to-  wake'up  haunted  with</span><span>  shot  and  shell  and  find  a-  prctty  face</span><span>  trying  to  -so'itbe  you.  I  liad  the  mis</span><span>  fortunB  to  frighten,  a  hospital  pic</span><span>  derly.  I  happened  to  he  dreaming,</span><span>  of  a'  Taube  dropping  bombs;  on  us</span><span>  and-  the  .  orderly  was  adjusting  my</span><span>  bedc.l-otli.es—  well,  he  went  for  his  life,""</span><span>  rfhd  got  tlie  sister  on'  night  diity.  I</span><span>  tried  to  apologise,  but  -the'  sister</span><span>  would  'not  let  mo;  I  ,  had  -bombs  on</span><span>  the  brain—  I  nearly  ran  into  one  over</span><span>  on  tbo  job  '-and  had-  an  attack  e-</span><span>  ""boinb  jumps!'  Lor  a.gofld  while  -aj-</span><span>  ierwards.  Had  fbeen  a  good  run</span><span>  ner  I  would  'liave.got  up  —  you  see,  a</span><span>  chap  can't  tell,  where  they  are  go</span><span>  ing  to  -  land  and  a  new  chum  always</span><span>  H'ries  to  ""cut  it  out""  under  ""evens,':'</span><span>  particularly;  'if  be  is  on  bis  own</span><span>  somewhere  and  hears  -  it  buzzing</span><span>  through  the  air.  Well,  to-day,  we  all</span><span>  o-ot  our-  Christinas,  billies—  evidently</span><span>  we'  ""are  not  .  forgotten,  "",iut  it  was</span><span>  amusing  .what  we  struck  'in  some  ot</span><span>  them.  I'gottwp  pa.fekets.oif  Mpsom</span><span>  salts  in'.  mine"".hm'6ngSt  a  '1st'  of  other</span><span>  things""  I  wonder  'how  the  -pimpm</span><span>  0-ot-  ""ss  mifeh  in  ""  the""1  -billy/  Plajhng</span><span>  cards  are'  numerous,  also  chocolates.</span><span>  There  s  i-wouup,  hap,  banker,  aa  a</span><span>  1-ot  of  other  games  on  the  board  to-</span><span>  d-ayJ  It  was  nothing  to  see  a.  two-</span><span>  up  School  in  the  trenches  with  bombs</span><span>  oping  off  over  their  head-s,  and  mach</span><span>  ine  gun  bullets  -  whistling  over.  ;  One-</span><span>  would  think  those  fellows  were  solid</span><span>  rocks  to  watch  them.  They  only</span><span>  disperse  when  an  officer  comes,  along;</span><span>  t,ut  he  generally  goes  the  other</span><span>  way  if  he  sees  them.  This  war  is</span><span>  the  ruuamiesfc  thing  ever  I  dreamt  ov</span><span>  I  chanced  to  pass  with  a.  wounded</span><span>  clvap  on  a  stretcher;  the  ""school</span><span>  immediately  suspended  operations</span><span>  and  made  way  for  ns  to  pass,  kept</span><span>  silent  until  we  had  passed,  and  then</span><span>  resumed  operations.  The  army  me</span><span>  dical  stretcher  bearers  have  made  a</span><span>  great  imputation  here-the  non-com</span><span>  batant  argument  has  been  knocked</span><span>  to  pieces.  I'd  explain:  A  shell</span><span>  bursts  amongst  a  squad  of  men;  it</span><span>  might  get  a  couple.  The  rest  of  the</span><span>  sfinad'  immediately  seek  shelter,  and</span></p> <p><span>  very  properly  so,  as  a  =>""</span><span>  not  risk  his  life  unnecessarily.  Well,-.</span><span>  the  word'  is  passed.  ,to  .  the,  :hearers</span><span>  and-  they  go  there,  no.  -matter  how</span><span>  many  shells  continue  to  come.  The</span><span>  resF  of  the  men.  are  under  cover;</span><span>  we  are  only  'spelling,""  remember,</span><span>  when-  .there  is  no  slaughter  or  a</span><span>  charge  ""might  come,  off  and  the  v/nund-</span><span>  to  Jl  /vxT«kiww1i  ftvfii-'  'The  .enemy  shells</span></p> <p><span>  the  /  rear  to.  prevent  anv  reiriforce-</span><span>  monts  '  comihg-;  to  the  ;  scene—  just  ,</span><span>  where  tlie  bearers  .  are  '  Working;  _  ti-e</span><span>  A  AM  0  s  do""'  not/wait  until  the  .fight</span><span>  :s""  over  to  collect  ,  the  wounded.  ?  We</span><span>  ivork  in'  24-hour  shifts  in  tlib  Field</span><span>  Ambulance  '.  .  mid  >'an  hardly  expect</span><span>  „ny  encmv  not  to  fire  on  us,  because</span><span>  „e  ate  always  amongst,  the  mcn</span></p> <p><span>  '  '  t;</span><span>  Take  inyr  tip,1  don't,  say  anything</span><span>  against  ya  Field  Ambulance  .'in  the</span><span>  presence  of  aiiy  of1  tho  '""boys""  who</span><span>  have  been  on  the  Peninsula!/  Our</span><span>  offigors  are  also  xoalji  'bricks''  /under</span><span>  fire,  but  the  ""picture'""  is  -the  two</span><span>  ''bearers""  carrying  la  wounded  ""man</span><span>  to  the  i(ear  dr  to  .the  jdifferent'felear-</span><span>  -ng  hospitals'  undief  mhrapnel  —  it/s</span><span>  worth  seeing.  I  don't  know  what  is</span><span>  goifife  to  liappen  pp.  whero  we  are</span><span>  going  to  row,  after  Anzqp—  and  we</span><span>  don't  -ci/re.  Our  ""boys""  have  fought</span><span>  for  thou-  ""rep""  and  w.e'll  do  our</span><span>  bit  '/anywhere  they  like  to  send  us.</span><span>  Australia  litis  ""been  thfero'?  and  M'.ili</span><span>  be  tHefe  aghin.  «wv  .  .  ...</span><span>  .  Private  George  Ekland  writes  .  as</span><span>  follows:  —  ""-MyyOeai-  -Mother  and</span><span>  AIL  —  ""I  am  writing  you  anotlier</span><span>  letfer,  and-  hope  you  -  received  the</span><span>  last  ones  alright.  I:  have  not  riad</span><span>  oiio  'from  .you  since  I  have  beon</span><span>  here.  I  suppose  they  «  have  gone</span><span>  ""Astray.  Xmas  passed  off  here  pretty,</span><span>  quiet,  but'  in  'Cairo  it  wasMiyely,,.,  )Ij</span><span>  wns  -on  pickettduty  in  Cairo.  op  -%ma«;</span><span>  Eve.  and  w'a»  patrolling  the  sti-eots</span><span>  until  XI  o'clock.  We  had  a  quarter</span><span>  of  an  hour  off  nt  a  time,  so  I  could</span><span>  nut""  have  -much  fun,  but  all  the  same</span><span>  I  enjoyed  my.self.  I  spent  rf'fjniser.</span><span>  able  Xmas  Daj',  as  I  Bad  to  liny  my</span><span>  dinner,  .but  -  it  wasn.'t  cooked  enough.</span><span>  We  .  never  'got  any  Xmhs  ;  .billies  ;</span><span>  neaidy  all  the  other  units  got..  .tliem;</span><span>  Wet  got  a  gifjt  from  the  Australian</span><span>  jColmliJprts  Fund,  consisting_  of  2</span><span>  jackets  leip,  a  l'e'ttes,  2  cigars,  1  tin  of</span><span>  'tobacco,  and  some  post  cams;  -we,</span><span>  were  very  tlijihkful  'to  get  them.  .4</span><span>  hope  all  at  hoine  h-ad  a4-  good  Xmas/</span><span>  I  suppose.-,  Cart  was  away.  ©Re.  Lenny-</span><span>  semi  me  fiis  address  -ivntl  tliQ  Batta-</span><span>  lon.  he  is  in,  so  ,  tliat-  1  can,  look  out</span><span>  for!,  him'  when  -lie.  copies  'over  liery-</span><span>  I  am  getting  fired""  of'-  this  place,  a'hd'</span><span>  T  lfopc  we  will  ""be  gpihg  to  the  front</span><span>  soon.  '  X  see  -by'  the'  paper  that  -  they</span><span>  Are  (going  to  send  '10,000  fc  mdutli</span><span>  ,froin  Australia,  the  more  the  mci-</span><span>  -rier,  as  I  think  every  young  fpllbw</span><span>  .should  enlist.  '-The  life  must.pgreo</span><span>  with  pie,  as  I  weight  10  stone  1  lb.</span><span>  now""  I;  was  only  8  st.  13  lbs.  when</span><span>  I  enlisted.  The  camp  is  alright,  but</span><span>  we  'think  it  is  time  we  had  a  go  at</span><span>  them.  1  met  Wally  Mclntyre,  and</span><span>  lie  wants  tb  be:  remembered  ton  you</span><span>  and-  Dad.  —  Your;  -loving  son,  George.</span></p> ",Article,1916-02-17,THE BILLY CAN.,172291291,2,2,"{'score': '114.23978', 'value': 'very relevant'}","Private J. Elliott, 3rd Field Ambulance, writes to the ''Mercury'' from Mena House Hospital, the Pyramids, under date Christmas,Day.","{'id': '837', 'value': 'Daily Mercury (Mackay, Qld. : 1906 - 1954)'}",https://trove.nla.gov.au/ndp/del/article/172291291?searchTerm=%27Daily+Mercury%27,/newspaper/172291291,"Daily Mercury (Mackay, Qld. : 1906 - 1954)",837
"<p><span>  !  ;  '-d  MIRAN1  SHIRE  OFFICE;  ""'  'f  ;'</span></p> <p><span>  (To  the  Editor.)</span></p> <p><span>  Sjirrt-yvc  see  by  a  letter,  in  last</span><span>  Saturday's  issue  qf  the  '/Mercury""</span><span>  that  Mr,  Gaorgq  Johnson,  .Chairman</span><span>  of  the  ?.i  Shirg'..  .Council,  .w.-cn,</span><span>  l:ke  to  know  by  what  authority  Jlic</span></p> <p><span>  iVLn;,«  bh;re  Rfitepiiyer7!'  Associa</span><span>  tion  assert,  in  our  circular  letter  to</span><span>  the-  riitepayers,  that'  he-  wrote  to  the</span><span>  Home  SocriA'  y  stating-,  the  :  inaju'iv</span><span>  i.ty  of  roteihiya.a.wished  to.  liave  Gar</span><span>  get  included  in  :  the.  /ballot  fpr  .the</span><span>  kite,  olf  p.the  shire  office.  -)Ye  -can  .</span><span>  readily'  supply  the  desired  informa</span><span>  tion.  ..Our  authority  for.  the'  state</span><span>  ment  is  the  report'  of  -  the  -meeting  of</span><span>  the  Mirarfi.  Shire  Council  as  pubiisli.</span><span>  ,qd  in  both  -Maekay  daily  pnpei's.  If</span><span>  'the  repdrts  of  the  Chairman's  action</span><span>  at  the  Sliii'o  Council  meeting  con</span><span>  veyed  an  erroneous  idea,  in  .nuyi-nuG</span><span>  tcrial  respect,  Of  what  actually  took</span><span>  place,  it;  was  tyis  business  to,  seo  that</span><span>  the'  reports  were  corrected.  Failing</span><span>  tlife  correction,  the  public  cannot  be</span><span>  blamed.  .for  taking  the  reports  as  be</span><span>  ing  substantially  correct.</span><span>  On  eu(|uiry""we  now  learn  that  Mr.</span><span>  .Johnson  ,'s  actual  words--  (at'  the  Shire</span><span>  Council  meeting)  referred:  to,  the  ma</span><span>  jority  q£  the  .ratepayer  in  his  di</span><span>  vision  o-f  thp  Shire—  not  of  the  .whoic</span><span>  Shire.  .  as  wo  gathered  IJroni  .  tnc</span><span>  nowsjiapcr  reports  of  the  meeting.</span><span>  To  our  ininitys  tlie  distinction  is  hard</span><span>  ly  material.'  At  the""same  meeting</span><span>  ,  lie  produced;  a  letter  to  thd  Home</span><span>  .  Secretary  which  he  had  prepared,</span><span>  /  eqnesting:  that  Gargdt  sltoulcf  be  i'fl'-</span><span>  cluded  in  the;  ballot  for  the  site  -of</span><span>  the  'Shire  -office:  Thils  letter  whs</span><span>  adopted  by  tJie  Council,.,  cojiied  by</span><span>  the  Clerk,  and  forwaudqd  to  tho  Home</span><span>  Secretary.  So  Mr.  .Johnson  should</span><span>  not  bo  surprised  .  if  '  tlie  public-  look</span><span>  upon  him  as  the  real  father  and  au</span><span>  thor  of  this  letter.  ""w</span><span>  In  our  circular  letter  7ve  have''  n&lt;.</span><span>  .particular  desire  to  criticise  Mi-</span><span>  Johnson's  action  in  this  matter.  Yv</span><span>  isimpfy  want  to  state  the  facts  beat</span><span>  ing  on  the  ballot  for  the  site  of  -ti;</span><span>  Shire  office.  AVc  took  considorah!</span><span>  pains  to  verify  every  statement  wc</span><span>  made;  and  to  avoid  personal  referen</span><span>  ces  :>s  far  as  possible.  We  believe</span><span>  that,  .the  claims  /'olf  Mirani  are  ,  such</span><span>  that  it  is  clearly  entitled  to  get  the,</span><span>  Shire  ofiice,  but-  we  want  to  obtain</span><span>  it  only  .by  fair  and  honourable</span><span>  moans.</span><span>  'The  ballot  for  the  site  of  the  Shire</span><span>  office  is  now  being  taken,  so  we  sliall</span><span>  soon  .know  how  many  ratepayers,  of</span><span>  the  Shire  really  want  -the.  Shire  of</span><span>  fice  at  Garget.  '  '</span><span>  Thanking  ""you  in  anticipation  for</span><span>  spac-e  for  this  letter.  Ynubi,  etc.,</span></p> <p><span>  GEO.  M.  SWAN,  Chairman.</span><span>  (R-.  RYAN/  Hon.  Secretary.</span><span>  Mirani  Shire  Ratepayers'  Associa--.-</span><span>  '  tion.  .</span></p> ",Article,1916-02-15,MIRANI SHIRE OFFICE. (To the Editor.),172291495,2,2,"{'score': '96.01853', 'value': 'very relevant'}","Sir -- We see by a letter, in last Saturday's issue of the ""Mercury"" that Mr. George Johnson, Chairman of the Shire Council, [?],","{'id': '837', 'value': 'Daily Mercury (Mackay, Qld. : 1906 - 1954)'}",https://trove.nla.gov.au/ndp/del/article/172291495?searchTerm=%27Daily+Mercury%27,/newspaper/172291495,"Daily Mercury (Mackay, Qld. : 1906 - 1954)",837
"<p><span>  IN  MEMORIAM.</span><span>  MARKS.—In  loving  memory  of  Rob-</span><span>  ert  Alexander  Marks,  who  died  on</span><span>  17th  March,  1912.</span><span>  ""Deeply  Regretted.""</span></p> <p><span>  The  Daily  Mercury-</span><span>  FRIDAY,    MARCH    17TH,  1916.</span></p> ",Family Notices,1916-03-17,Family Notices,172300998,5,5,"{'score': '92.77727', 'value': 'very relevant'}",,"{'id': '837', 'value': 'Daily Mercury (Mackay, Qld. : 1906 - 1954)'}",https://trove.nla.gov.au/ndp/del/article/172300998?searchTerm=%27Daily+Mercury%27,/newspaper/172300998,"Daily Mercury (Mackay, Qld. : 1906 - 1954)",837
"<p><span>  THANKS.</span><span>  MR.  AND  MRS.  ADAM  LISK,  of</span><span>  Owen's  Creek,  desire  to  Thank</span><span>  all  kind  friends  for  their  sympathy,</span><span>  kindness,  messages  of  condolence,</span><span>  and  floral  tributes  during    their  re-</span><span>  cent  sad  bereavement.</span></p> <p><span>  The  Daily  Mercury</span><span>  TUESDAY,  MAY  30,  1916.</span></p> ",Family Notices,1916-05-30,Family Notices,188688765,2,2,"{'score': '77.36208', 'value': 'very relevant'}",,"{'id': '837', 'value': 'Daily Mercury (Mackay, Qld. : 1906 - 1954)'}",https://trove.nla.gov.au/ndp/del/article/188688765?searchTerm=%27Daily+Mercury%27,/newspaper/188688765,"Daily Mercury (Mackay, Qld. : 1906 - 1954)",837
